{
  "$schema": "https://json-schema.org/draft/2020-12/schema",
  "$id": "pairwise-manifest.schema.json",
  "title": "Agent Pairwise Coverage Manifest v1",
  "type": "object",
  "additionalProperties": false,
  "required": ["schema_version", "generator", "status", "common_dimensions", "coverage_profiles", "notes"],
  "properties": {
    "schema_version": {"const": "1.0"},
    "generator": {"$ref": "#/$defs/generator"},
    "status": {"enum": ["incomplete", "complete"]},
    "common_dimensions": {
      "type": "object",
      "additionalProperties": false,
      "required": ["transport", "session", "outcome", "scenario", "action"],
      "properties": {
        "transport": {"type": "array", "minItems": 1, "uniqueItems": true, "items": {"enum": ["sync", "sse"]}},
        "session": {"type": "array", "minItems": 1, "uniqueItems": true, "items": {"enum": ["new", "existing", "refresh"]}},
        "outcome": {"type": "array", "minItems": 1, "uniqueItems": true, "items": {"enum": ["success", "partial", "failure", "timeout", "cancel"]}},
        "scenario": {"type": "array", "minItems": 1, "uniqueItems": true, "items": {"enum": ["none", "single_sop", "pending", "multi_frame"]}},
        "action": {"type": "array", "minItems": 1, "uniqueItems": true, "items": {"enum": ["none", "knowledge", "read_tool", "side_effect_tool", "general_skill"]}}
      }
    },
    "coverage_profiles": {
      "type": "object",
      "additionalProperties": false,
      "required": ["0A_legacy", "provider_contract"],
      "properties": {
        "0A_legacy": {"$ref": "#/$defs/profile"},
        "provider_contract": {"$ref": "#/$defs/profile"}
      }
    },
    "notes": {"type": "array", "items": {"type": "string", "minLength": 1}}
  },
  "$defs": {
    "generator": {
      "type": "object",
      "additionalProperties": false,
      "required": ["name", "version", "seed", "tie_breaker", "dimension_order"],
      "properties": {
        "name": {"const": "staffdeck_deterministic_greedy_pairwise"},
        "version": {"const": "1.0.0"},
        "seed": {"const": 0},
        "tie_breaker": {"const": "lexicographic_assignment"},
        "dimension_order": {
          "const": ["transport", "session", "outcome", "scenario", "action", "provider_boundary"]
        }
      }
    },
    "profile": {
      "type": "object",
      "additionalProperties": false,
      "required": ["status", "required_from_phase", "provider_boundary", "constraints", "coverage", "cases", "missing_pairs_are_gate_failures"],
      "properties": {
        "status": {"enum": ["incomplete", "complete", "deferred"]},
        "required_from_phase": {"enum": ["0A", "provider_contract_slice"]},
        "provider_boundary": {"type": "array", "minItems": 1, "uniqueItems": true, "items": {"type": "string", "minLength": 1}},
        "constraints": {"type": "array", "items": {"$ref": "#/$defs/constraint"}},
        "coverage": {"oneOf": [{"$ref": "#/$defs/coverage"}, {"type": "null"}]},
        "cases": {"type": "array", "items": {"$ref": "#/$defs/case"}},
        "missing_pairs_are_gate_failures": {"const": true}
      },
      "allOf": [
        {
          "if": {"properties": {"status": {"const": "complete"}}, "required": ["status"]},
          "then": {
            "properties": {
              "constraints": {"minItems": 1},
              "coverage": {"$ref": "#/$defs/coverage"},
              "cases": {"minItems": 1}
            }
          }
        },
        {
          "if": {"properties": {"status": {"const": "deferred"}}, "required": ["status"]},
          "then": {
            "properties": {
              "constraints": {"maxItems": 0},
              "coverage": {"type": "null"},
              "cases": {"maxItems": 0}
            }
          }
        }
      ]
    },
    "constraint": {
      "type": "object",
      "additionalProperties": false,
      "required": ["id", "variant_id", "entrypoint", "allowed"],
      "properties": {
        "id": {"type": "string", "pattern": "^LC[0-9]{2}-[a-z0-9-]+$"},
        "variant_id": {"type": "string", "pattern": "^GT[0-9]{2}-[a-z0-9-]+$"},
        "entrypoint": {"enum": ["chat_sync", "chat_sse"]},
        "allowed": {"$ref": "#/$defs/values"}
      }
    },
    "coverage": {
      "type": "object",
      "additionalProperties": false,
      "required": ["strength", "legal_assignment_count", "legal_pair_count", "covered_pair_count", "coverage_digest", "require_each_constraint"],
      "properties": {
        "strength": {"const": 2},
        "legal_assignment_count": {"type": "integer", "minimum": 0},
        "legal_pair_count": {"type": "integer", "minimum": 0},
        "covered_pair_count": {"type": "integer", "minimum": 0},
        "coverage_digest": {"type": "string", "pattern": "^sha256:(?:[a-f0-9]{64}|pending)$"},
        "require_each_constraint": {"const": true}
      }
    },
    "case": {
      "type": "object",
      "additionalProperties": false,
      "required": ["case_id", "constraint_id", "variant_id", "entrypoint", "values"],
      "properties": {
        "case_id": {"type": "string", "pattern": "^PW0A-[0-9]{3}$"},
        "constraint_id": {"type": "string", "pattern": "^LC[0-9]{2}-[a-z0-9-]+$"},
        "variant_id": {"type": "string", "pattern": "^GT[0-9]{2}-[a-z0-9-]+$"},
        "entrypoint": {"enum": ["chat_sync", "chat_sse"]},
        "values": {"$ref": "#/$defs/scalar_values"}
      }
    },
    "values": {
      "type": "object",
      "additionalProperties": false,
      "required": ["transport", "session", "outcome", "scenario", "action", "provider_boundary"],
      "properties": {
        "transport": {"type": "array", "minItems": 1, "uniqueItems": true, "items": {"enum": ["sync", "sse"]}},
        "session": {"type": "array", "minItems": 1, "uniqueItems": true, "items": {"enum": ["new", "existing", "refresh"]}},
        "outcome": {"type": "array", "minItems": 1, "uniqueItems": true, "items": {"enum": ["success", "partial", "failure", "timeout", "cancel"]}},
        "scenario": {"type": "array", "minItems": 1, "uniqueItems": true, "items": {"enum": ["none", "single_sop", "pending", "multi_frame"]}},
        "action": {"type": "array", "minItems": 1, "uniqueItems": true, "items": {"enum": ["none", "knowledge", "read_tool", "side_effect_tool", "general_skill"]}},
        "provider_boundary": {"type": "array", "minItems": 1, "uniqueItems": true, "items": {"type": "string", "minLength": 1}}
      }
    },
    "scalar_values": {
      "type": "object",
      "additionalProperties": false,
      "required": ["transport", "session", "outcome", "scenario", "action", "provider_boundary"],
      "properties": {
        "transport": {"enum": ["sync", "sse"]},
        "session": {"enum": ["new", "existing", "refresh"]},
        "outcome": {"enum": ["success", "partial", "failure", "timeout", "cancel"]},
        "scenario": {"enum": ["none", "single_sop", "pending", "multi_frame"]},
        "action": {"enum": ["none", "knowledge", "read_tool", "side_effect_tool", "general_skill"]},
        "provider_boundary": {"type": "string", "minLength": 1}
      }
    }
  }
}
