{
  "schema_version": "1.0",
  "generator": {
    "name": "staffdeck_deterministic_greedy_pairwise",
    "version": "1.0.0",
    "seed": 0,
    "tie_breaker": "lexicographic_assignment",
    "dimension_order": ["transport", "session", "outcome", "scenario", "action", "provider_boundary"]
  },
  "status": "incomplete",
  "common_dimensions": {
    "transport": ["sync", "sse"],
    "session": ["new", "existing", "refresh"],
    "outcome": ["success", "partial", "failure", "timeout", "cancel"],
    "scenario": ["none", "single_sop", "pending", "multi_frame"],
    "action": ["none", "knowledge", "read_tool", "side_effect_tool", "general_skill"]
  },
  "coverage_profiles": {
    "0A_legacy": {
      "status": "complete",
      "required_from_phase": "0A",
      "provider_boundary": ["not_applicable", "local_raw_exchange"],
      "constraints": [
        {
          "id": "LC01-plain-chat-sync",
          "variant_id": "GT01-sync",
          "entrypoint": "chat_sync",
          "allowed": {
            "transport": ["sync"],
            "session": ["new", "existing", "refresh"],
            "outcome": ["success"],
            "scenario": ["none"],
            "action": ["none"],
            "provider_boundary": ["not_applicable"]
          }
        },
        {
          "id": "LC02-plain-chat-sse",
          "variant_id": "GT01-sse",
          "entrypoint": "chat_sse",
          "allowed": {
            "transport": ["sse"],
            "session": ["new", "existing", "refresh"],
            "outcome": ["success"],
            "scenario": ["none"],
            "action": ["none"],
            "provider_boundary": ["not_applicable"]
          }
        },
        {
          "id": "LC03-runtime-failure-sse",
          "variant_id": "GT13-llm-error",
          "entrypoint": "chat_sse",
          "allowed": {
            "transport": ["sse"],
            "session": ["new", "existing", "refresh"],
            "outcome": ["failure"],
            "scenario": ["none"],
            "action": ["none"],
            "provider_boundary": ["not_applicable"]
          }
        },
        {
          "id": "LC04-explicit-cancel-sse",
          "variant_id": "GT12-cancel",
          "entrypoint": "chat_sse",
          "allowed": {
            "transport": ["sse"],
            "session": ["new", "existing"],
            "outcome": ["cancel"],
            "scenario": ["none"],
            "action": ["none"],
            "provider_boundary": ["not_applicable"]
          }
        },
        {
          "id": "LC05-single-sop-sync",
          "variant_id": "GT03-true",
          "entrypoint": "chat_sync",
          "allowed": {
            "transport": ["sync"],
            "session": ["new", "existing", "refresh"],
            "outcome": ["success"],
            "scenario": ["single_sop"],
            "action": ["none"],
            "provider_boundary": ["not_applicable"]
          }
        },
        {
          "id": "LC06-single-sop-sse",
          "variant_id": "GT02-ask-refresh-continue",
          "entrypoint": "chat_sse",
          "allowed": {
            "transport": ["sse"],
            "session": ["new", "existing", "refresh"],
            "outcome": ["success"],
            "scenario": ["single_sop"],
            "action": ["none"],
            "provider_boundary": ["not_applicable"]
          }
        },
        {
          "id": "LC07-pending-work-sync",
          "variant_id": "GT05-pending",
          "entrypoint": "chat_sync",
          "allowed": {
            "transport": ["sync"],
            "session": ["existing", "refresh"],
            "outcome": ["partial"],
            "scenario": ["pending"],
            "action": ["none"],
            "provider_boundary": ["not_applicable"]
          }
        },
        {
          "id": "LC08-multi-frame-sse",
          "variant_id": "GT05-multi-frame",
          "entrypoint": "chat_sse",
          "allowed": {
            "transport": ["sse"],
            "session": ["existing", "refresh"],
            "outcome": ["success"],
            "scenario": ["multi_frame"],
            "action": ["none"],
            "provider_boundary": ["not_applicable"]
          }
        },
        {
          "id": "LC09-knowledge-chat-sse",
          "variant_id": "GT07-citation-refresh",
          "entrypoint": "chat_sse",
          "allowed": {
            "transport": ["sse"],
            "session": ["new", "existing", "refresh"],
            "outcome": ["success"],
            "scenario": ["none"],
            "action": ["knowledge"],
            "provider_boundary": ["local_raw_exchange"]
          }
        },
        {
          "id": "LC10-required-knowledge-sop-sync",
          "variant_id": "GT08-query-before-advance",
          "entrypoint": "chat_sync",
          "allowed": {
            "transport": ["sync"],
            "session": ["existing", "refresh"],
            "outcome": ["success"],
            "scenario": ["single_sop"],
            "action": ["knowledge"],
            "provider_boundary": ["local_raw_exchange"]
          }
        },
        {
          "id": "LC11-read-tool-sop-sync",
          "variant_id": "GT09-read",
          "entrypoint": "chat_sync",
          "allowed": {
            "transport": ["sync"],
            "session": ["existing", "refresh"],
            "outcome": ["success"],
            "scenario": ["single_sop"],
            "action": ["read_tool"],
            "provider_boundary": ["local_raw_exchange"]
          }
        },
        {
          "id": "LC12-side-effect-replay-sync",
          "variant_id": "GT10-replay",
          "entrypoint": "chat_sync",
          "allowed": {
            "transport": ["sync"],
            "session": ["existing", "refresh"],
            "outcome": ["success"],
            "scenario": ["none"],
            "action": ["side_effect_tool"],
            "provider_boundary": ["local_raw_exchange"]
          }
        },
        {
          "id": "LC13-side-effect-unknown-sse",
          "variant_id": "GT10-unknown",
          "entrypoint": "chat_sse",
          "allowed": {
            "transport": ["sse"],
            "session": ["existing", "refresh"],
            "outcome": ["partial", "timeout"],
            "scenario": ["none"],
            "action": ["side_effect_tool"],
            "provider_boundary": ["local_raw_exchange"]
          }
        },
        {
          "id": "LC14-general-skill-standalone-sync",
          "variant_id": "GT11-standalone",
          "entrypoint": "chat_sync",
          "allowed": {
            "transport": ["sync"],
            "session": ["new", "existing", "refresh"],
            "outcome": ["success"],
            "scenario": ["none"],
            "action": ["general_skill"],
            "provider_boundary": ["local_raw_exchange"]
          }
        },
        {
          "id": "LC15-general-skill-sop-sse",
          "variant_id": "GT11-sop",
          "entrypoint": "chat_sse",
          "allowed": {
            "transport": ["sse"],
            "session": ["existing", "refresh"],
            "outcome": ["partial"],
            "scenario": ["single_sop"],
            "action": ["general_skill"],
            "provider_boundary": ["local_raw_exchange"]
          }
        },
        {
          "id": "LC16-sop-failure-sync",
          "variant_id": "GT06-retry-limit",
          "entrypoint": "chat_sync",
          "allowed": {
            "transport": ["sync"],
            "session": ["existing", "refresh"],
            "outcome": ["failure"],
            "scenario": ["single_sop"],
            "action": ["none"],
            "provider_boundary": ["not_applicable"]
          }
        }
      ],
      "coverage": {
        "strength": 2,
        "legal_assignment_count": 41,
        "legal_pair_count": 123,
        "covered_pair_count": 123,
        "coverage_digest": "sha256:90c4c3892f4881f8618ff2b143954f94619b354f770c50bb3514f6aa32ffc82d",
        "require_each_constraint": true
      },
      "cases": [
        {
          "case_id": "PW0A-001",
          "constraint_id": "LC04-explicit-cancel-sse",
          "variant_id": "GT12-cancel",
          "entrypoint": "chat_sse",
          "values": {"transport": "sse", "session": "existing", "outcome": "cancel", "scenario": "none", "action": "none", "provider_boundary": "not_applicable"}
        },
        {
          "case_id": "PW0A-002",
          "constraint_id": "LC15-general-skill-sop-sse",
          "variant_id": "GT11-sop",
          "entrypoint": "chat_sse",
          "values": {"transport": "sse", "session": "refresh", "outcome": "partial", "scenario": "single_sop", "action": "general_skill", "provider_boundary": "local_raw_exchange"}
        },
        {
          "case_id": "PW0A-003",
          "constraint_id": "LC12-side-effect-replay-sync",
          "variant_id": "GT10-replay",
          "entrypoint": "chat_sync",
          "values": {"transport": "sync", "session": "existing", "outcome": "success", "scenario": "none", "action": "side_effect_tool", "provider_boundary": "local_raw_exchange"}
        },
        {
          "case_id": "PW0A-004",
          "constraint_id": "LC05-single-sop-sync",
          "variant_id": "GT03-true",
          "entrypoint": "chat_sync",
          "values": {"transport": "sync", "session": "new", "outcome": "success", "scenario": "single_sop", "action": "none", "provider_boundary": "not_applicable"}
        },
        {
          "case_id": "PW0A-005",
          "constraint_id": "LC07-pending-work-sync",
          "variant_id": "GT05-pending",
          "entrypoint": "chat_sync",
          "values": {"transport": "sync", "session": "refresh", "outcome": "partial", "scenario": "pending", "action": "none", "provider_boundary": "not_applicable"}
        },
        {
          "case_id": "PW0A-006",
          "constraint_id": "LC09-knowledge-chat-sse",
          "variant_id": "GT07-citation-refresh",
          "entrypoint": "chat_sse",